Type,Title,Legacy ID,Detail,
SYREQ,System Comaptibility,ZBS01-22235,"ZBPro should be compatible on common office PCs, display and internet connection, and the user should be able to set up the required hardware easily","<span  style=font-family: Arial;>ZBPro should be compatible on common office PCs, display and internet connection, and the user should be able to set up the required hardware easily.</span>"
SYREQ,Credentials ,ZBS01-22231,Users shall be able to log in using credentials,<span  style=font-family: Arial;>Users shall be able to log in using credentials</span>
SYREQ,ECG Upload,ZBS01-22230,The web interface should allow users to upload ECG raw tracing data.,<span  style=font-family: Arial;>The web interface should allow users to upload ECG raw tracing data.</span>
SYREQ,Displaying ECG,ZBS01-22229,The web interface should display ECGs without distortion and display the delineation of the ECG,<span  style=font-family: Arial;>The web interface should display ECGs without distortion and display the delineation of the ECG.</span>
SYREQ,Annotating ECG,ZBS01-22228,ZBPro(TM) should annotate ECGs and display labels for arrhythmias detected during analysis,<span  style=font-family: Arial;>ZBPro(TM) should annotate ECGs and display labels for arrhythmias detected during analysis.</span>
SYREQ,UI for Analysis,ZBS01-22234,The web interface should provide tools to help the user analyze the ECG and edit the report,<span  style=font-family: Arial;>The web interface should provide tools to help the user analyze the ECG and edit the report.</span>
SYREQ,"Editing comments, notes and Interpretation",ZBS01-22233,"The user should be able to enter and edit preliminary comments, notes and interpretations","<span  style=font-family: Arial;>The user should be able to enter and edit preliminary comments, notes and interpretations.</span>"
SYREQ,Physician's Interface,ZBS01-22232,ZBPro(TM) should provide the user with an interface for physician overread and a process for approving or rejecting reports,<span  style=font-family: Arial;>ZBPro(TM)<span id=polarion-comment:2></span> should provide the user with an interface for physician overread and a process for approving or rejecting reports.</span>
ARCH,"Balancing Security, Performance, Reliability, Scalability and Cost",ZBS01-22788,"The technical platform for ZBPro shall be selected and designed to optimize for a balance of security, performance, reliability, scalability, and cost","<span  style=font-size: 10pt;font-family: Arial;line-height: 1.5;>            <br>          </span> <table style=width: 80%;margin-left: auto;margin-right: auto;empty-cells: show;border-collapse: collapse;>            <tbody>              <tr>                <th style=background-color: #F0F0F0;text-align: left;vertical-align: top;width: 284px;height: 9pt;border: 1px solid #CCCCCC;padding: 0pt;>                  <span style=font-size: 10pt;font-family: Arial;line-height: 1.5;>                    <span style=font-weight: bold;>                      <span id=polarion-comment:51></span>Technical Platform Constraint</span>                    <br>                  </span>                </th>                <th style=background-color: #F0F0F0;text-align: left;vertical-align: top;width: 316px;height: 9pt;border: 1px solid #CCCCCC;padding: 0pt;>                  <span style=font-size: 10pt;font-family: Arial;line-height: 1.5;>                    <span style=font-weight: bold;>Implementation</span>                    <br>                  </span>                </th>              </tr>              <tr>                <td style=vertical-align: top;width: 284px;height: 754px;border: 1px solid #CCCCCC;padding: 0pt;>                  <span style=font-size: 10pt;font-family: Arial;line-height: 1.5;>The technical platform for ZBPro shall be selected and designed to optimize for a balance of security, performance, reliability, scalability, and cost. The platform shall leverage the best of the breed, standards-based technologies.<br>                  </span>                </td>                <td style=vertical-align: top;width: 316px;height: 754px;border: 1px solid #CCCCCC;padding: 0pt;>                  <span style=font-size: 10pt;font-family: Arial;line-height: 1.5;>The system uses the Amazon AWS cloud platform. In particular, the system<br>                  </span> <ul>                    <li>                      <span style=font-size: 10pt;font-family: Arial;line-height: 1.5;>uses the ALB to scale horizontally when incoming traffic increases or decreases by adding or deleting EC2 instances.<br>                      </span>                    </li>                    <li>                      <span style=font-size: 10pt;font-family: Arial;line-height: 1.5;>uses the EFS to scale file systems automatically as files are added, removed and burse to higher throughput levels when necessary.<br>                      </span>                    </li>                    <li>                      <span style=font-size: 10pt;font-family: Arial;line-height: 1.5;>uses the EFS to securely and reliably access data files with a managed file system in Amazon AWS for 99.999999999% durability and up to 99.99% of availability<sup>(https://aws.amazon.com/efs/)</sup>.<br>                      </span>                    </li>                    <li>                      <span style=font-size: 10pt;font-family: Arial;line-height: 1.5;>uses the RDS, fully managed at AWS for MariaDB services, without needing to provision infrastructure or maintain software, achieve high availability with RDS multi-AZ deployments, and benefit from proven security best practices in databases born in the cloud<sup>(https://aws.amazon.com/rds)</sup>.<br>                      </span>                    </li>                    <li>                      <span style=font-size: 10pt;font-family: Arial;line-height: 1.5;>uses the EB that automatically handles the deployment, from capacity provisioning, load balancing, auto-scaling to application health monitoring. Meanwhile through its dashboard, ZBPro has full control over the AWS resources powering the ZBPro-API. There is no additional charge for the EB and only the AWS resources needed to store and run the ZBPro-API are charged<sup>(https://aws.amazon.com/elasticbeanstalk/)</sup>.<br>                      </span>                    </li>                    <li>                      <span style=font-size: 10pt;font-family: Arial;line-height: 1.5;>uses the IAM in AWS to grant role-based security credentials to authorize personals that access the ZBPro resources, and specify who can access services and resources in AWS, centrally manage fine-grained role-based permissions to AWS resources, prevention of unauthorized users.<br>                        <br>                      </span>                    </li>                  </ul>                </td>              </tr>            </tbody>          </table>"
ARCH,Minimize Attack Surface area and Blast Radius,ZBS01-23885,Minimize attack surface area and blast radius of a potential attack,"<table  style=width: 89.68%;margin-left: auto;margin-right: auto;empty-cells: show;>            <tbody>              <tr>                <th style=background-color: #F0F0F0;text-align: left;vertical-align: top;width: 270px;height: 9pt;border: 1px solid #CCCCCC;padding: 0pt;>                  <span style=font-size: 10pt;font-family: Arial;line-height: 1.5;>Security Constraint<br>                  </span>                </th>                <th style=background-color: #F0F0F0;text-align: left;vertical-align: top;width: 403px;height: 9pt;border: 1px solid #CCCCCC;padding: 0pt;>                  <span style=font-size: 10pt;font-family: Arial;line-height: 1.5;>Implementation<br>                  </span>                </th>              </tr>              <tr>                <td style=width: 270px;height: 392px;border: 1px solid #CCCCCC;padding: 0pt;>                  <span style=font-size: 10pt;font-family: Arial;line-height: 1.5;>Minimize attack surface area and blast radius of a potential attack.<br> &nbsp;</span>                </td>                <td style=width: 403px;height: 392px;border: 1px solid #CCCCCC;padding: 0pt;>                  <span style=font-size: 10pt;font-family: Arial;line-height: 1.5;>                    <span id=polarion-comment:73></span>The business processing functionality leverages interfaces that are only available on a private network (AWS VPC (virtual private network)). These interfaces are not available to the general public or even customers and customer networks. Access to the virtual private network is limited to only the presentation layer (web front end) of the ZBPro application.<br>                    <br> The ZBPro web application (presentation layer) is the only service that exposes an endpoint outside of a private network. This endpoint is hosted on an AWS elastic load balancer. Access to the public endpoint is limited to customer managed IP ranges. For example, a customer may employ 300 users that require access to ZBPro. The load balancer is configured to block all traffic, except that originating from the customer network via customer managed outbound IP addresses, typically a small range of IP addresses.<br>                    <br> Access to the public load balanced IP address is also limited to a single port. The limited set of users that can access the load balancer can only do so on port 443 via an SSL encrypted protocol.<br>                    <br>                  </span>                </td>              </tr>            </tbody>          </table>"
ARCH,ZBPro Independent of Wi-Fi,ZBS01-23886,The use of Wi-Fi shall be independent of the ZBPro product,"<table  style=width: 89.68%;margin-left: auto;margin-right: auto;empty-cells: show;>            <tbody>              <tr>                <th style=background-color: #F0F0F0;text-align: left;vertical-align: top;width: 285px;height: 9pt;border: 1px solid #CCCCCC;padding: 0pt;>                  <span style=font-family: Arial;>Security Constraint<br>                  </span>                </th>                <th style=background-color: #F0F0F0;text-align: left;vertical-align: top;width: 426px;height: 9pt;border: 1px solid #CCCCCC;padding: 0pt;>                  <span style=font-family: Arial;>Implementation<br>                  </span>                </th>              </tr>              <tr>                <td style=width: 285px;height: 9pt;border: 1px solid #CCCCCC;padding: 0pt;>                  <span style=font-family: Arial;>The use of Wi-Fi shall be independent of the ZBPro product<br>                  </span>                </td>                <td style=width: 426px;height: 9pt;border: 1px solid #CCCCCC;padding: 0pt;>                  <span style=font-family: Arial;>                    <span style=font-size: 10pt;line-height: 1.5;>                      <span id=polarion-comment:75></span>                    </span> <span style=font-size: 10pt;line-height: 1.5;>The use of Wi-Fi is independent of the ZBPro product and is out of the product scope as it pertains to the functionality and security posture of the ZBPro product.</span>                    <br>                    <br> <span style=font-size: 10pt;line-height: 1.5;>The ZBPro software will not connect to any wireless networks. There will be no capability built into the product for this functionality. ZBPro is hosted within runtime environments provided by AWS services. These services provide a capability to connect to a physical, wired network.</span>                    <br>                    <br> <span style=font-size: 10pt;line-height: 1.5;>The ZBPro software is not a portable device that would be able to connect to a wireless network. It is hosted within AWS and is only connected to AWS VPC&rsquo;s (private networks) managed by ZBeats administrators.</span>                    <br>                    <br> <span style=font-size: 10pt;line-height: 1.5;>ZBPro web application has a public IP address hosted on an AWS Application Load Balancer. Access to this endpoint is limited to restricted customer networks.</span>                    <br>                    <br> <span style=font-size: 10pt;line-height: 1.5;>Risk for this type of connection is covered in 08122022 Cybersecurity Threat Assessment Report by Harbor Labs.</span>                    <br>                  </span>                </td>              </tr>            </tbody>          </table>"
ARCH,ZBPro Remote Access Restrictions,ZBS01-23887,Remote access to ZBPro software shall be restricted,"<table  style=width: 80%;margin-left: auto;margin-right: auto;empty-cells: show;>            <tbody>              <tr>                <th style=background-color: #F0F0F0;text-align: left;vertical-align: top;width: 214pt;height: 9pt;border: 1px solid #CCCCCC;border-top: 1px solid #CCCCCC;border-bottom: 1px solid #CCCCCC;border-right: 1px solid #CCCCCC;border-left: 1px solid #CCCCCC;padding: 0pt;>                  <span style=font-family: Arial;>Security Constraint<br>                  </span>                </th>                <th style=background-color: #F0F0F0;text-align: left;vertical-align: top;width: 236pt;height: 9pt;border: 1px solid #CCCCCC;border-top: 1px solid #CCCCCC;border-bottom: 1px solid #CCCCCC;border-right: 1px solid #CCCCCC;border-left: 1px solid #CCCCCC;padding: 0pt;>                  <span style=font-family: Arial;>Implementation<br>                  </span>                </th>              </tr>              <tr>                <td style=width: 214pt;height: 9pt;border: 1px solid #CCCCCC;border-top: 1px solid #CCCCCC;border-bottom: 1px solid #CCCCCC;border-right: 1px solid #CCCCCC;border-left: 1px solid #CCCCCC;padding: 0pt;>                  <span style=font-family: Arial;>Remote access to ZBPro software shall be restricted.<br>                  </span>                </td>                <td style=width: 236pt;height: 9pt;border: 1px solid #CCCCCC;border-top: 1px solid #CCCCCC;border-bottom: 1px solid #CCCCCC;border-right: 1px solid #CCCCCC;border-left: 1px solid #CCCCCC;padding: 0pt;>                  <span style=font-family: Arial;>                    <span style=font-size: 10pt;line-height: 1.5;>                      <span id=polarion-comment:76></span>The ZBPro software is hosted in AWS accounts managed by ZBeats. It is remotely accessible by only a limited administrative team. This team has the required access to update and maintain the software. &nbsp;All administrative access and control is centrally managed in the hosting environments in AWS.</span>                    <br>                    <br> <span style=font-size: 10pt;line-height: 1.5;>Customers can access the web interface for the application, but only have access to execute specific actions based on their roles. There are no settings that affect the core functionality of the product that can be changed remotely through the product interface.</span>                    <br>                  </span>                </td>              </tr>            </tbody>          </table>"
ARCH,Securing Data in Transit System,ZBS01-22782,Data in the transit system shall be secured,"<span  style=font-size: 10pt;font-family: Arial;line-height: 1.5;>            <span id=polarion-comment:69></span>            <span id=polarion-comment:70></span>            <span id=polarion-comment:71></span>            <br>          </span> <table style=width: 80%;margin-left: auto;margin-right: auto;empty-cells: show;border-collapse: collapse;>            <tbody>              <tr>                <th style=background-color: #F0F0F0;text-align: left;vertical-align: top;width: 214pt;height: 9pt;border: 1px solid #CCCCCC;border-top: 1px solid #CCCCCC;border-bottom: 1px solid #CCCCCC;border-right: 1px solid #CCCCCC;border-left: 1px solid #CCCCCC;padding: 0pt;>                  <span style=font-size: 10pt;font-family: Arial;line-height: 1.5;>                    <span style=font-weight: bold;>                      <span id=polarion-comment:63></span>Security Constraint</span>                    <br>                  </span>                </th>                <th style=background-color: #F0F0F0;text-align: left;vertical-align: top;width: 236pt;height: 9pt;border: 1px solid #CCCCCC;border-top: 1px solid #CCCCCC;border-bottom: 1px solid #CCCCCC;border-right: 1px solid #CCCCCC;border-left: 1px solid #CCCCCC;padding: 0pt;>                  <span style=font-size: 10pt;font-family: Arial;line-height: 1.5;>                    <span style=font-weight: bold;>Implementation</span>                    <br>                  </span>                </th>              </tr>              <tr>                <td style=vertical-align: top;width: 214pt;height: 9pt;border: 1px solid #CCCCCC;border-top: 1px solid #CCCCCC;border-bottom: 1px solid #CCCCCC;border-right: 1px solid #CCCCCC;border-left: 1px solid #CCCCCC;padding: 0pt;>                  <span style=font-size: 10pt;font-family: Arial;line-height: 1.5;>Data in the transit system shall be secured<br>                  </span>                </td>                <td style=vertical-align: top;width: 236pt;height: 9pt;border: 1px solid #CCCCCC;border-top: 1px solid #CCCCCC;border-bottom: 1px solid #CCCCCC;border-right: 1px solid #CCCCCC;border-left: 1px solid #CCCCCC;padding: 0pt;>                  <span style=font-size: 10pt;font-family: Arial;line-height: 1.5;>First, the data in the transit from the ZBPro-UI (a user&rsquo;s web browser) and ZBPro-API (the backend server) is secured by the HTTPS with a valid SSL certificate. Second, the EFS system of the ZBPro-API file systems always encrypt the data at rest and in transit by enabling the TLS<span id=polarion-comment:36></span>.<br>                  </span>                </td>              </tr>            </tbody>          </table>"
ARCH,Principle of Least Privilege,ZBS01-22781,ZBPro shall ensure the principle of least privilege which means enforcing a minimum level of user rights that allow the user to perform the user's role,"<span  style=font-size: 10pt;font-family: Arial;line-height: 1.5;>            <br>          </span> <table style=width: 80%;margin-left: auto;margin-right: auto;empty-cells: show;border-collapse: collapse;>            <tbody>              <tr>                <th style=background-color: #F0F0F0;text-align: left;vertical-align: top;width: 215pt;height: 9pt;border: 1px solid #CCCCCC;border-top: 1px solid #CCCCCC;border-bottom: 1px solid #CCCCCC;border-right: 1px solid #CCCCCC;border-left: 1px solid #CCCCCC;padding: 0pt;>                  <span style=font-size: 10pt;font-family: Arial;line-height: 1.5;>                    <span style=font-weight: bold;>                      <span id=polarion-comment:64></span>Security&nbsp;Constraint</span>                    <br>                  </span>                </th>                <th style=background-color: #F0F0F0;text-align: left;vertical-align: top;width: 236pt;height: 9pt;border: 1px solid #CCCCCC;border-top: 1px solid #CCCCCC;border-bottom: 1px solid #CCCCCC;border-right: 1px solid #CCCCCC;border-left: 1px solid #CCCCCC;padding: 0pt;>                  <span style=font-size: 10pt;font-family: Arial;line-height: 1.5;>                    <span style=font-weight: bold;>Implementation</span>                    <br>                  </span>                </th>              </tr>              <tr>                <td style=vertical-align: top;width: 215pt;height: 9pt;border: 1px solid #CCCCCC;border-top: 1px solid #CCCCCC;border-bottom: 1px solid #CCCCCC;border-right: 1px solid #CCCCCC;border-left: 1px solid #CCCCCC;padding: 0pt;>                  <span style=font-size: 10pt;font-family: Arial;line-height: 1.5;>ZBPro shall ensure the principle of least privilege which means enforcing a minimum level of user rights that allow the user to perform the user's role<span id=polarion-comment:37></span>                    <br>                  </span>                </td>                <td style=vertical-align: top;width: 236pt;height: 9pt;border: 1px solid #CCCCCC;border-top: 1px solid #CCCCCC;border-bottom: 1px solid #CCCCCC;border-right: 1px solid #CCCCCC;border-left: 1px solid #CCCCCC;padding: 0pt;>                  <span style=font-size: 10pt;font-family: Arial;line-height: 1.5;>Each user is required to login with their credentials. The user's credentials are tied to their user role. Only tasks and features the user is expected to perform based on their role will be visible and accessible to the user. For API calls, the user will submit the API call with their token/credentials. The token/credentials will be checked to determine if they meet the privilege requirement for the API. If the token/credentials do not meet the privilege, then the API call is denied.&nbsp;<br>                  </span>                </td>              </tr>            </tbody>          </table>"
ARCH,Authenticating the Users,ZBS01-22780,ZBPro shall authenticate the users to ensure the system and data is accessed authorized users,"<span  style=font-size: 10pt;font-family: Arial;line-height: 1.5;>            <br>          </span> <table style=width: 80%;margin-left: auto;margin-right: auto;empty-cells: show;border-collapse: collapse;>            <tbody>              <tr>                <th style=background-color: #F0F0F0;text-align: left;vertical-align: top;width: 264px;height: 9pt;border: 1px solid #CCCCCC;padding: 0pt;>                  <span style=font-size: 10pt;font-family: Arial;line-height: 1.5;>                    <span style=font-weight: bold;>Security Constraint</span>                    <br>                  </span>                </th>                <th style=background-color: #F0F0F0;text-align: left;vertical-align: top;width: 336px;height: 9pt;border: 1px solid #CCCCCC;padding: 0pt;>                  <span style=font-size: 10pt;font-family: Arial;line-height: 1.5;>                    <span style=font-weight: bold;>Implementation</span>                    <br>                  </span>                </th>              </tr>              <tr>                <td style=vertical-align: top;width: 264px;height: 9pt;border: 1px solid #CCCCCC;padding: 0pt;>                  <span style=font-size: 10pt;font-family: Arial;line-height: 1.5;>                    <span id=polarion-comment:65></span>ZBPro shall authenticate the users to ensure the system and data is accessed authorized users.<br>                  </span>                </td>                <td style=vertical-align: top;width: 336px;height: 9pt;border: 1px solid #CCCCCC;padding: 0pt;>                  <span style=font-size: 10pt;font-family: Arial;line-height: 1.5;>First, each user must use password and MFA to access the ZBPro frontend web browsers. Also, a user role is placed to control the access of different user roles (such as HCP, technician, medical supervisor and admins). Second the ZBPro management users use the IAM management to control over access to AWS resources where ZBPro deploys. Both a strong password policy and an MFA (multi-factor access) are enforced. Data is only accessed to authorized users with required user roles.<br>                  </span>                </td>              </tr>            </tbody>          </table>"
